ADAM CREMONENSIS	<ADAMO DA CREMONA>	De regimine et via itineris et fine peregrinantium
ADAMNANUS HIIENSIS	<ADAMNANO DI IONA>	De locis sanctis
ADORNES [ADURNUS], ANSELMUS	<ADORNO, ANSELMO>	Itinerarium Hierosolymitanum et Sinaiticum
ADORNES [ADURNUS], IOHANNES	<ADORNO, GIOVANNI>	Itinerarium in Asiam et Africam
AETHERIA MONACHA [AEGERIA]	<EGERIA>	Itinerarium (Peregrinatio ad loca santa)
AETHICUS ISTRICUS [AETHICUS PHILOSOPHUS; AETHICUS ISTER]	<ETICO ISTRO>	Cosmographia
ALBERTUS AQUENSIS	<ALBERTO DI AQUISGRANA>	Historia Hierosolymitanae expeditionis (De via et expeditione Ierusalem)
ALBERTUS BOHEMUS	<ALBERT VON BEHAIM>	Descriptio gentium et diversarum nationum Europe
ALBERTUS DE BONSTETTEN	<ALBRECHT VON BONSTETTEN>	Superioris Germaniae confoederationis descriptio
ALBERTUS STADENSIS	<ALBERTO DI STADE>	Annales Stadenses
ALBERTUS, LEO BAPTISTA	<ALBERTI, LEON BATTISTA>	Descriptio urbis Romae
ALTE, GEORGIUS		Descriptio Nuremberge
AMELII DE BRENACO, PETRUS 	<AMELI, PIETRO>	Itinerarium Gregorii XI Avenione Romam
ANDREAS PERUSINUS [DE PERUSIO]	<ANDREA DA PERUGIA>	Epistola <*1326, viaggio in Cina>
ANGLERIA, BOSCHINUS DE	<ANGHIERA, BOSCHINO D’>	De situ et salubritate aeris civitatis Mediolani
ANONYMUS LEIDENSIS	<ANONIMO DI LEIDA>	De situ orbis
ANONYMUS MEDIOLANENSIS	<ANONIMO MILANESE>	Libellus de situ civitatis Mediolani (Datiana historia)
ANONYMUS RAVENNAS [GEOGRAPHUS RAVENNAS]	<ANONIMO RAVENNATE; GEOGRAFO RAVENNATE>	Cosmographia
ANONYMUS SUESSIONENSIS	<ANONIMO DI SOISSONS>	De terra Hierosolimitana
ANSELMUS REMENSIS	<ANSELMO REMENSE; ANSELMO DI REIMS>	Historia dedicationis ecclesiae sancti Remigii apud Remos (Itinerarium papae Leonis IX a. 1049 in Galliam)
ARIOSTUS, ALEXANDER 	<ARIOSTO, ALESSANDRO>	Itinerarium ad Montem Sinai
ARIOSTUS, ALEXANDER 	<ARIOSTO, ALESSANDRO>	Topographia terrae promissionis
BALBUS, HIERONYMUS 	<BALBI, GIROLAMO>	Hodoeporicon elegia Bohuslao de Hasistein
BALCUS		Descriptio Helvetiae (Descriptio elegans agri et regionis Svitensium)
BALDERICUS BURGULIANUS [BURGULIENSIS; ANDEGAVENSIS; DOLENSIS]	<BAUDRI DE BOURGUEIL>	Epistola ad Fiscannenses (Itinerarium) (Relatio de monasterio Fiscannensi)
BARROTIUS, IOHANNES	<BAROZZI, GIOVANNI>	Mons Euganeus
BARTHOLOMAEUS ANGLICUS	<BARTOLOMEO ANGLICO>	Geographia orbis
BASINUS [BAZINUS], THOMAS	<BASIN, THOMAS>	Breviloquium peregrinationis
BAYGUERA [DE BAYGUERIS], BARTHOLOMEUS	<BAYGUERA, BARTOLOMEO>	Itinerarium
BEBELIUS, HENRICUS IUSTINGENSIS	<BEBEL, HEINRICH>	Carmen de urbe Constantia
BEDA VENERABILIS	<BEDA IL VENERABILE>	Liber de locis sanctis
BEDA VENERABILIS	<BEDA IL VENERABILE>	Nomina regionum atque locorum de Actibus apostolorum
BELARDUS DE ESCULO	<BELARDO D’ASCOLI>	Descriptio Terrae Sanctae
BEMBUS, BERNARDUS 	<BEMBO, BERNARDO>	Descriptio sui itineris
BENEDICTUS POLONUS	<BENEDETTO POLACCO; BENEDYKT POLAK>	De itinere fratrum minorum ad Tartaros
BENIAMINUS TUDELENSIS	<BENIAMINO [BEN JONAH] DI TUDELA>	Itinerarium
BERNARDUS MONACHUS [BERNARDUS SAVIUS; BERNARDUS FRANCUS]	<BERNARDO IL MONACO; BERNARDO IL SAGGIO>	Itinerarium in loca sancta
BIANCHELLUS, MENGHUS	<BIANCHELLI, DOMENICO>	De balneis tractatus
BLONDUS, FLAVIUS	<BIONDO, FLAVIO>	De Roma instaurata
BLONDUS, FLAVIUS	<BIONDO, FLAVIO>	Italia illustrata
BOCCACCIUS, IOHANNES	<BOCCACCIO, GIOVANNI>	De Canaria et insulis reliquis ultra Hispaniam noviter repertis
BOCCACCIUS, IOHANNES	<BOCCACCIO, GIOVANNI>	De montibus, lacubus, fluminibus, stagnis et paludibus, et de nominibus maris
BONDELMONTIUS, CHRISTOPHORUS	<BUONDELMONTI, CRISTOFORO>	Descriptio insulae Cretae (Descriptio insulae Candiae)
BONDELMONTIUS, CHRISTOPHORUS	<BUONDELMONTI, CRISTOFORO>	Liber insularum Archipelagi
BONONIUS, HIERONYMUS TARVISINUS	<BOLOGNI, GIROLAMO>	Mediolanum (Itinerarium)
BORNADUS DE BRIXIA, VIRGILIUS 		Itinerarium
BOVERIUS, AMADEUS		Libellus peregrinationis totius Terrae Sanctae
BRACELLUS, IACOBUS	<BRACELLI, GIACOMO>	Descriptio orae Ligusticae
BREYDENBACH, BERNARDUS DE	<BREYDENBACH, BERNHARD VON>	Peregrinatio in Terram Sanctam
BRIGGIUS, THOMAS	<BRYGG, THOMAS>	Itinerarium ad Terram Sanctam domini Thomae de Swynburne
BRUNUS, LEONARDUS [LEONARDUS ARETINUS]	<BRUNI, LEONARDO>	De temporibus suis (Rerum suo tempore gestarum commentarius)
BRUNUS, LEONARDUS [LEONARDUS ARETINUS]	<BRUNI, LEONARDO>	Historiae Florentini populi
BRUNUS, LEONARDUS [LEONARDUS ARETINUS]	<BRUNI, LEONARDO>	Laudatio Florentinae urbis
BRUSSERIUS SAVONENSIS, PHILIPPUS 	<BRUSSERI, FILIPPO>	Descriptio Terrae Sanctae (Liber peregrinationis)
BURCHARDUS ARGENTINENSIS	<BURCHARD VON STRASSBURG; BURCARDO DI STRASBURGO>	Relatio de itinere in Terram Sanctam
BURCHARDUS DE MONTE SION [BURCHARDUS THEUTONICUS]	<BURCARDO DEL MONTE SION>	Descriptio Terrae Sanctae
CAMPANUS, IOHANNES ANTONIUS	<CAMPANO, GIOVANNI ANTONIO>	De Thrasimeni foelicitate ad Pandulphum Balionium (Trasimeni descriptio)
CANISTRIS, OPICINUS DE	<CANISTRIS, OPICINO DE’>	Liber de laudibus civitatis Ticinensis (Libellus de descriptione Papiae)
CAOURSINUS, GUILLELMUS	<CAOURSIN, GUILLAMUME>	Obsidionis Rhodiae urbis descriptio (Descriptio obsidionis Rhodiae)
CASTELLO, BONAVENTURA DE	<CASTELLI, BONAVENTURA>	Recepta aquae balnei de Porrecta
CELTIS, CONRADUS	<CELTIS [CELTES; PICKEL], CONRAD [KONRAD]>	De origine, situ, moribus et institutis Norimbergae libellus
COCI DE WIMPINA, CONRADUS	<KOCH, KONRAD>	Descriptio universitatis et urbis Lipsiensis
COLUMBUS, CHRISTOPHORUS	<COLOMBO, CRISTOFORO>	Epistola de insulis nuper inventis <*trad. lat. di Leander de Cosco>
COMITIBUS, NICOLAUS DE	<CONTI, NICCOLÒ DE’>	India recognita
CONSTABULUS	<QUSTA IBN LUQA; COSTA BEN LUCA>	De locis habitabilibus
CRANCHIS [DE CRANCHIS] DOMNIUS  [DODINUS; DOMNUS; DOYMUS]	<HRANKOVIĆ [KRANČIĆ; KRANKOVIĆ], DUJAM>	Bracie insulae descriptio
CURIALTIS, PETRUS DE [PETRUS DE TUSSIGNANO; DE THAUXIGNANO]	<CURIALTI, PIETRO; PIETRO DA TOSSIGNANO>	Liber de balneis Burmi
CYRIACUS ANCONITANUS	<CIRIACO D’ANCONA; PIZZICOLLI, CIRIACO DE’>	Itinerarium
DECEMBRIUS, HUBERTUS	<DECEMBRIO, UBERTO>	Descriptio Pragensis urbis et nonnulla de moribus populi in ea existentibus
DERMATIUS HIBERNIENSIS		Itineraria seu exhortatoria proficiscentis Jerusalem
DIVERSIS DE QUARTIGIANIS, PHILIPPUS DE	<DIVERSI, FILIPPO>	Situs, aedificiorum, politiae et laudabilium consuetudinum inclytae civitatis Ragusii ad ipsius Senatum descriptio
DOMINICUS SILVESTRI DE FLORENTIA	<DOMENICO DI SILVESTRO>	De insulis et earum proprietatibus (Opus in additamentum ad Iohannis Boccacci tractatum De montibus, silvis, fontibus, lacubus, fluminibus, stagnis seu paludibus et de diversis nominibus maris)
DONDIS AB HOROLOGIO, IOHANNES DE	<DONDI DELL’OROLOGIO, GIOVANNI>	Iter Romanum
DYNAMIUS	<DINAMIO AGIOGRAFO>	De Lerine insula
EMMERICHIUS, GEORGIUS 	<HEMMERICH, GEORG>	Descriptio peregrinationis ad Terram Sanctam
EUCHERIUS LUGDUNENSIS <*auctor incertus>	<EUCHERIO DI LIONE>	De situ Hierosolymae (De situ Hierosolymitanae urbis)
FABRI, FELIX	<FABRI [FABER; SCHMID], FELIX>	Descriptio Theutoniae, Sveviae et civitatis Ulmensis
FABRI, FELIX	<FABRI [FABER; SCHMID], FELIX>	Evagatorium in Terrae sanctae, Arabiae et Egypti peregrinationem
FEDANZOLA PERUSINUS [DE PERUSIO], IOHANNES 	<FEDANZOLA, GIOVANNI>	Descriptio Terre Sancte
FREDERICI, GUILLELMUS	<FREDERIKS, WILLEM>	De Frisiorum situ, origine, moribus, rebus gestis et viris illustribus
FRETELLUS DE NAZARETH, RORGUS	<FRETELLO DI NAZARETH, RORGO> 	Liber locorum sanctorum terrae Ierusalem
FRIDERICUS DE FULGINEO	<FREZZI DA FOLIGNO, FEDERICO >	Epistola ad Iacobum II Aragonie regem de modo procedendi ut facilius et commodius dictam insulam [Sardiniae] consequatur
FRULOVISIUS, TITUS LIVIUS	<FRULOVISI, TITO LIVIO>	Peregrinatio
FULCHERIUS CARNOTENSIS	<FULCHERIO DI CHARTRES>	Historia Iherololymitana Francorum Iherusalem peregrinantium
GABRIELIS DE PECHWARODINO	<GABRIEL DE PÉCSVÁRAD>	Compendium locorum Terrae Sanctae
GALATHEUS, ANTONIUS	<GALATEO, ANTONIO; DE FERRARIIS, ANTONIO>	De Hierosolymitana peregrinatione (Argonautica)
GALATHEUS, ANTONIUS	<GALATEO, ANTONIO; DE FERRARIIS, ANTONIO>	De situ elementorum
GALATHEUS, ANTONIUS	<GALATEO, ANTONIO; DE FERRARIIS, ANTONIO>	De situ Iapygiae
GALATHEUS, ANTONIUS	<GALATEO, ANTONIO; DE FERRARIIS, ANTONIO>	De situ terrarum
GALATHEUS, ANTONIUS	<GALATEO, ANTONIO; DE FERRARIIS, ANTONIO>	Descriptio urbis Callipolis (Callipolis descriptio)
GALLUS, ANTONIUS	<GALLO, ANTONIO>	Commentarius de Genuensium maritima classe in Barchinonenses expedita
GALLUS, ANTONIUS	<GALLO, ANTONIO>	Commentarii rerum Genuensium
GALLUS, ANTONIUS	<GALLO, ANTONIO>	De navigatione Columbi per inaccessum antea Oceanum comentariolum
GENTILIS FULGINEUS [FULGINAS; DE FULGINEO; DE GENTILIBUS]	<GENTILE DA FOLIGNO>	De balneis
GEOGRAPHUS BAVARUS	<GEOGRAFO BAVARESE>	Descriptio civitatum ad septentrionalem plagam Danubii
GERALDINUS, ALEXANDER	<GERALDINI, ALESSANDRO>	Itinerarium ad regiones sub aequinoctiali plaga constitutas
GILO PARISIENSIS	<GILLES DI PARIGI>	Historia gestorum viae nostri temporis Ierosolymitanae
GIRALDUS CAMBRENSIS	<GIRALDO CAMBRENSE; GIRALDO DI BARRI; GIRALDO DEL GALLES>	Descriptio Kambriae
GIRALDUS CAMBRENSIS	<GIRALDO CAMBRENSE; GIRALDO DI BARRI; GIRALDO DEL GALLES>	Itinerarium Kambriae
GIRALDUS CAMBRENSIS	<GIRALDO CAMBRENSE; GIRALDO DI BARRI; GIRALDO DEL GALLES>	Topographia Hiberniae
GRATOROLUS, GUILIELMUS	<GRATAROLI, GUGLIELMO>	De thermis Rhaeticis et Vallis Treschurii agri Bergomatis
GREGORIUS TERRACINENSIS	<GREGORIO DI TERRACINA>	Versus de transitu peregrinorum ad sepulcrum Domini et captione Hierosolymitanae urbis
GRIMOALDI, ANGLICUS	<GRIMOARD, ANGLIC DE>	Descriptio civitatis Bononie
GRIMOALDI, ANGLICUS	<GRIMOARD, ANGLIC DE>	Descriptio Romandiole
GRINEUS, GILBERTUS	<GRINEO, GILBERTO>	Topographia divi Hieronymi Sacelli
GUIBERTUS TORNACENSIS [DE TORNACO]	<GUIBERT DE TOURNAI; GUIBERT VAN DOORNIK>	De locis mundis
GUIBERTUS TORNACENSIS [DE TORNACO]	<GUIBERT DE TOURNAI; GUIBERT VAN DOORNIK>	Hodoeporicon primae profectionis Ludovici Galliae regis in Syriam
GUIDONIS, BERNARDUS	<GUI, BERNARDO; GUIDONI, BERNARDO>	Descriptio Galliarum
GUILIELMUS DE BOLDENSELE	<GUILLAUME DE BOLDENSELE>	Liber de quibusdam ultramarinis partibus et praecipue de Terra Sancta (Hodoeporicon ad Terram sanctam)
GUILLELMUS DE RUBRUC	<GUGLIELMO DI RUBRUCK; WILLEM VAN RUYSBROECK; GUILLAUME DE RUBROUCK>	Itinerarium
GUILLELMUS FILIUS STEPHANI	<WILLIAM FITZSTEPHEN>	Descriptio Londoniae
GUILLELMUS GAUDENSIS [DE GOUDA]	<WILLEM VAN GOUDA>	Peregrinationes totius Terrae Sanctae
GUILLELMUS GRANDIMONTENSIS		Itinerarium reliquiarum sanctarum septem virginum sociarum Sanctae Ursulae e diocesi Coloniensi in ecclesiam Grandimontis
HAYTONUS DE CORYCUS [ANTONIUS CURCHINUS]	<HETʾUM DI CORYCUS; HETOUM DI CORYCUS; AYTON DI CORYCUS>	Flos historiarum terrae Orientis (Liber historiarum partium Orientis)
HENRICUS DE ANTWERPE	<*auctor incertus>	Tractatus de urbe Brandenburg (Tractatus de captione urbis Brandenburgensis)
HENRICUS DE GLACZ		Relatio de mirabilibus orientalium Tatarorum
HENRICUS DE GUNDELFINGEN	<HEINRICH VON GUNDELFINGEN>	Elogium, seu Descriptio, Confoederationis Helveticae
HENRICUS DE GUNDELFINGEN	<HEINRICH VON GUNDELFINGEN>	Topographia urbis Bernensis
HIERONYMUS CORDUBENSIS		Descriptio Cordubae
HILDEBERTUS CENOMANENSIS	<ILDBERTO DI LAVARDIN>	Insula Meldis ave
HUGO DE SANCTO VICTORE	<UGO DI SAN VITTORE>	Descriptio mappe mundi
HUGOLINUS DE MONTE CATINO	<CACCINI, UGOLINO>	De balneorum Italiae proprietatibus ac virtutibus
HUMBERTUS DE DIVIONE [DIVIONENSIS]	<HUMBERT DE DIJON>	Liber de locis et conditionibus Terrae Sanctae et sepulcro
HYACINTHUS PRESBYTER		Itinerarium (Descriptio Terrae Sanctae)
HYVANUS, ANTONIUS SARZANENSIS	<IVANI DA SARZANA, ANTONIO >	De situ urbis Romae
IACOBUS DE VITRIACO	<JACQUES DE VITRY>	Historia Hierosolymitana
IACOBUS DE VORAGINE	<IACOPO DA VARAZZE>	Quadragesimale viatoris
IACOBUS VERONENSIS	<JACOPO DA VERONA>	Liber peregrinationis (Collectio peregrinationum in terras orientales)
IOHANNES DE CERMENATE	<GIOVANNI DA CERMENATE>	Historia de situ Ambrosianae urbis
IOHANNES DE GALONIFONTIBUS	<JEAN DE GAILLEFONTAINE>	Libellus de notitia orbis
IOHANNES DE MANDAVILLA [MAGDOVILLANUS; MAGNOVILLANUS; DE SANCTO ALBANO]	<JEAN DE MANDEVILLE>	Itinerarius a terra Anglie in partes Iherosolomitanas et in ulteriores marinas
IOHANNES DE MEERHOUT		Tractatulus de laude terrae Brabantiae (De laude Brabantiae)
IOHANNES DE PERUSIO	<GIOVANNI DA PERUGIA>	Descriptio Terrae Sanctae cum indice omnium eiusdem locorum (Opusculum descriptionis Terrae Sanctae)
IOHANNES DE PLANO CARPINI	<GIOVANNI DA PIAN DEL CARPINE>	Historia Mongalorum
IOHANNES DE SANCTO OMERO		Impugnatio descriptionis Northfolchiae
IOHANNES TEUXBURIENSIS	<JOHN OF TEWKESBURY>	De situ universorum
IOHANNES FRANCOFURDINUS	<JOHANNES VON FRANKFURT>	Itinerarius
IOHANNES WIRZBURGENSIS	<JOHANNES VON WÜRZBURG>	Descriptio Terrae Sanctae
IONAS BOBIENSIS <*auctor incertus>	<GIONA DI BOBBIO>	Carmen de Hibernia insula
IULIANUS HUNGARUS [IULIANUS FRATER]	<FRATE GIULIANO>	Epistola de vita Tartarorum (De vita Tartarorum sive Tractatus de Tartaris ad episcopum Perusinum apostolicae sedis legatum)
IUSTULUS, PETRUS FRANCISCUS	<GIUSTOLO, PIER FRANCESCO>	Descriptio montis Spoleto imminentis ad Clarelium Lupum
KNUYT VAN SLYTERHOVEN, HERMANNUS	<KNUYT VAN SLYTERHOVEN, HERMANN>	Scornetta
LAGENATOR DE FRANCOFORDIA, IOHANNES 		Itinerarius
LI MUISIS [MUCIDUS], AEGIDIUS	<LI MUISIS [LE MUISET], GILLES>	Itinerarium expeditionis Romam
LUDOLPHUS DE SUDHEIM [SUCHENSIS]	<LUDOLFO DI SUDHEIM [SUCHEN; SUTHEN]; LUDOLF VON SUDHEIM>	De itinere Terrae Sanctae
LUDOVICUS DE RUPE CAVARDI		Itinerarium in Terram Sanctam
LUDOVICUS DE VARTHEMA [DE BARTHEMA; VERTOMANNUS]	<LUDOVICO DI VARTHEMA>	Novum itinerarium
LUPUS DE PALACIIS RUBEIS, IOHANNES	<LOPEZ DE PALACIOS RUBIOS, JUAN>	Insularum maris oceani tractatus
MACHNAEUS, DOMINICUS	<MACANAEO, DOMENICO>	Chorographya Verbani lacus
MARIANUS DE FLORENTIA	<MARIANO DA FIRENZE>	Itinerarium urbis Romae
MARIGNOLLIS, IOHANNES DE	<MARIGNOLLI, GIOVANNI DE’>	Chronicon Bohemorum
MARINUS DE FREGENO	<MARINO DI FREGENO>	Descriptio provinciarum Alamannorum
MARTHONO, NICOLAUS DE 	<MARTONI, NICOLA DE>	Liber peregrinationis ad loca sancta
MATTHAEUS PARISIENSIS	<MATTEO DI PARIGI>	Iter de Londinio in Terram Sanctam
MATTHAEUS PARISIENSIS	<MATTEO DI PARIGI>	Tabulae geographicae
MAURITIUS FRATER		Itinerarium in Terram Sanctam
MONETARIUS, HIERONYMUS	<MÜNZER, HIERONYMUS>	Itinerarium
MONTAGNANA, BARTHOLOMAEUS	<MONTAGNANA, BARTOLOMEO>	De balneis patavinis
MORONUS, BARTHOLOMAEUS	<MORONE, BARTOLOMEO>	Dissertatio de Lecto Padi, a Ticino usque ad Urbem Mantuam
MUSSIS, IOHANNES DE	<MUSSI, GIOVANNI DE’>	Placentinae urbis ac nonnullarum nobilium tum in ea, tum per Italiam familiarum descriptio (Notabilia mundi)
NETTUCCIUS, AUGUSTINUS	<VESPUCCI [NETTUCCI], AGOSTINO>	De situ totius Hispaniae (De situ, longitudine, forma et divisione totius Hispaniae libellus)
NICOLUS [NICOLAI; DE NICOLI], NICOLAUS	<NICCOLI, NICCOLÒ>	Commentarium in peregrinatione Germaniae
NICOLAUS BOTRUNTINENSIS	<NICOLA DI LIGNY>	Relatio de itinere Italico Henrici VII imperatoris
NICOLAUS DE ROSENBERG	<NIKOLAUS VON ROSENBERG>	De situ, moribus et diversitate Scythicarum gentium
ODO DE DIOGILO [DEOGILO]	<EDES DE DEUIL>	De profectione Ludovici VII in Orientem
ODORICUS DE PORTU NAONIS	<ODORICO DA PORDENONE>	Itinerarium (Relatio de mirabilibus orientalium Tatarorum)
OLIVERIUS COLONIENSIS	<OLIVIERO DA COLONIA>	Descriptio Terrae Sanctae
<OPUS SINE AUCTORE>		Chronicon Terrae Sanctae (Libellus de expugnatione Terrae Sanctae per Saladinum)
<OPUS SINE AUCTORE>		De Gallica Petri Damiani profectione et eius ultramontano itinere
<OPUS SINE AUCTORE>		De Hierusalem et de locis sanctis
<OPUS SINE AUCTORE>		De itinere Frisorum
<OPUS SINE AUCTORE>		De loci Goslariensis fundatione
<OPUS SINE AUCTORE>		De locis sanctis martyrum quae sunt foris civitatis Romae
<OPUS SINE AUCTORE>		De rebus naturalibus et curiositatibus Terrae Sanctae
<OPUS SINE AUCTORE>		De situ Albanie
<OPUS SINE AUCTORE>		De situ Brecheniauc
<OPUS SINE AUCTORE>		De situ urbis Hierusalem (Descriptio locorum sanctorum circa Hierusalem adiacentium)
<OPUS SINE AUCTORE>		Descriptio Constantinopolis
<OPUS SINE AUCTORE>		Descriptio Europae Orientalis (Proiectum de recuperatione Terrae Sanctae)
<OPUS SINE AUCTORE>		Descriptio Florentinae urbis et reipublicae
<OPUS SINE AUCTORE>		Descriptio Italiae
<OPUS SINE AUCTORE>		Descriptio Marchiae Anconitanae
<OPUS SINE AUCTORE>		Descriptio Northfolchiae
<OPUS SINE AUCTORE>		Descriptio positionis seu situationis monasterii Claraevallensis
<OPUS SINE AUCTORE>		Descriptio regni Cataiae
<OPUS SINE AUCTORE>		Descriptio sanctorum locorum Hierusalem
<OPUS SINE AUCTORE>		Descriptio Terrae Sanctae
<OPUS SINE AUCTORE>		Descriptiones terrarum
<OPUS SINE AUCTORE>		Expositio mappae mundi
<OPUS SINE AUCTORE>		Haec sunt loca que habentur iuxta Hierosolimam commemoratione digna
<OPUS SINE AUCTORE>		Historia de Hierosolymitano itinere
<OPUS SINE AUCTORE>		Historia peregrinorum (Expeditio Asiatica Friderici Barbarossae)
<OPUS SINE AUCTORE>		Itinerarium ad Terram Sanctam
<OPUS SINE AUCTORE>		Itinerarium Antonini Placentini
<OPUS SINE AUCTORE>		Itinerarium cuiusdam Anglici Terram Sanctam et alia loca sancta visitantis
<OPUS SINE AUCTORE>		Itinerarium de Brugis
<OPUS SINE AUCTORE>		Itinerarium Einsidlense (Itinerarium urbis Romae)
<OPUS SINE AUCTORE>		Liber de existencia rivierarum et forma maris nostri Mediterranei
<OPUS SINE AUCTORE>		Loca et civitates Terrae Sanctae
<OPUS SINE AUCTORE>		Loca sancta visitanda in partibus Ierusalem
<OPUS SINE AUCTORE>		Memoria de illis monasteriis quae sunt in extremis Hierusalem in terra promissionis
<OPUS SINE AUCTORE>		Narratio de itinere navali peregrinorum Hierosolymam tendentium et Silviam capientium
<OPUS SINE AUCTORE>		Narratio itineris navalis ad Terram Sanctam
<OPUS SINE AUCTORE>		Navigatio Sancti Brendani
<OPUS SINE AUCTORE>		Oppositum montem conscendere cernis Orontem (Tractatus de fluvio Oronte)
<OPUS SINE AUCTORE>		Ordinationes loci sancti Salvatoris de Silva lacus fratrum Eremitarum Ordinis Sancti Augustini
<OPUS SINE AUCTORE>		Ordo peregrinationum in Iherusalem
<OPUS SINE AUCTORE>		Peregrinatio Antiochie per Urbanum papam facta
<OPUS SINE AUCTORE>		Peregrinatio et indulgentie Terre Sancte
<OPUS SINE AUCTORE>		Situs orbis terrae vel regionum
<OPUS SINE AUCTORE>		Tractatus de distantiis locorum Terrae Sanctae
ORICELLARIUS, BERNARDUS	<RUCELLAI, BERNARDO>	De urbe Roma liber
PALLADIUS FUSCUS [PALLADIUS NIGER]	<NEGRI, PALLADIO>	De situ orae Illyrici
PANTHEUS, IOHANNES ANTONIUS	<PANTEO, GIOVANNI ANTONIO>	Annotationes ex trium dierum confabulationibus de thermis Caldarianis
PARAVICINUS, PETRUS PAULUS	<PARRAVICINI, PIETRO PAOLO>	De Masinensium et Burmiensium thermarum situ, natura miraculisque
PASCHALIS DE VICTORIA		Epistola de suo in Tartariam itinere
PASINUS, LUDOVICUS	<PASINI, LUDOVICO>	Liber in quo de thermis Patavinis ac quibusdam aliis Italiae balneis tractatur
PAULUS, HIERONYMUS 	<PAU, JERONI>	Ad Barcinonem urbem
PAULUS SANCTONINUS [PAULUS DE SANCTONINIS]	<PAOLO SANTONINO>	Itinerarium
PETRARCHA, FRANCISCUS 	<PETRARCA, FRANCESCO>	Topographiam Hibernicam ad Giraldi Barrensis
PETRARCHA, FRANCISCUS	<PETRARCA, FRANCESCO>	Ityneriarum breve de Ianua usque ad Ierusalem et Terram Sanctam (Itinerarium Syriacum)
PETRUS BLESENSIS	<PIERRE DE BLOIS; PIETRO DI BLOIS>	Conquestio de dilatione viae Ierosolimitanae (De Hierosolymitana peregrinatione acceleranda sive De itinere Hierosolymitano)
PETRUS DE DUSBURG	<PETER VON DUSBURG; PIETRO DI DUISBURG>	Chronica terrae Prussiae
PETRUS DE EBULO	<PIETRO DA EBOLI>	De balneis Puteolanis
PETRUS DE PENNIS		Libellus de locis ultramarinis
PETRUS DIACONUS	<PIETRO DIACONO>	De locis sanctis
PHILIPPUS DE ELEEMOSYNA	<FILIPPO DI HARVENG; FILIPPO DI BONNE-ESPÉRANCE>	Historia miraculorum Bernardi in itinere Germanico patratorum
PHILIPPUS DE SLANE HIBERNICUS	<PHILIP DE SLANE; FILIPPO DI SLANE>	Giraldi Cambrensis Libellus de descriptione Hyberniae abbreviatus<anni?>
PICAUDUS, AIMERICUS	<PICAUD, AIMERY>	Iter pro peregrinis ad Compostellam
PIPINUS, FRANCISCUS	<PIPINO, FRANCESCO>	Tractatus de locis Terrae Sanctae anno 1320 visitatis
PICCOLOMINI, AENEAS SILVIUS [PIUS SECUNDUS]	< PICCOLOMINI, ENEA SILVIO [PIO II]>	Cosmographia (Historiae rerum ubique gestarum locorumque descriptio)
PICCOLOMINI, AENEAS SILVIUS [PIUS SECUNDUS]	< PICCOLOMINI, ENEA SILVIO [PIO II]>	De Asia
PICCOLOMINI, AENEAS SILVIUS [PIUS SECUNDUS]	< PICCOLOMINI, ENEA SILVIO [PIO II]>	De Europa
PICCOLOMINI, AENEAS SILVIUS [PIUS SECUNDUS]	< PICCOLOMINI, ENEA SILVIO [PIO II]>	De ritu, situ, moribus et conditione Germaniae descriptio
POLITIANUS, ANGELUS	<POLIZIANO, ANGELO; AMBROGINI, ANGELO>	Odoeporicon
POLONER, IOHANNES		Descriptio Terrae Sanctae
POMPONIUS LAETUS, IULIUS	<POMPONIO LETO, GIULIO>	De regionibus et Urbis vetustatibus descriptio (De antiquitatibus urbis Romae libellus sive Descriptio urbis Romae)
PONTANUS, IOANNES IOVIANUS	<PONTANO, GIOVANNI>	Hendecasyllaborum seu Baiarum libri
PONTANUS, IOANNES IOVIANUS	<PONTANO, GIOVANNI>	Meteororum liber
RADULPHUS DE COGGESHALL		Chronicon Terrae Sanctae
RADULPHUS DE FRAMMELSBERG		Itinerarium in Palestinam, ad montem Sinai et in Aegyptum
RADULPHUS NIGER	<RODOLFO IL NERO; RALPH NIGER>	De re militari et triplici via peregrinationis Ierosolimitanae
REBOLDIS, ANTONIUS DE [ANTONIUS DE CREMONA]	<REBOLDI, ANTONIO DE’; ANTONIO DA CREMONA >	Itinerarium ad Montem Sinai
REBOLDIS, ANTONIUS DE [ANTONIUS DE CREMONA]	<REBOLDI, ANTONIO DE’; ANTONIO DA CREMONA >	Itinerarium ad Sepulcrum Domini
RICHARDUS DE TEMPLO [RICARDUS CANONICUS SANCTAE TRINITATIS LONDONIENSIS]		Itinerarium peregrinorum et gesta regis Ricardi
RICOBALDUS FERRARIENSIS	<RICCOBALDO DA FERRARA>	Liber de locis orbis et insularum et marium
RICOLDUS DE MONTE CRUCIS	<RICCOLDO DA MONTECROCE>	Liber peregrinationis (Itinerarius)
ROGERIUS DE HOVEDEN	<*auctor incertus>	<RUGGERO DI HOVEDEN>	De viis maris
SABELLICUS, MARCUS ANTONIUS	<SABELLICO [COCCIO], MARCANTONIO>	De Venetae urbis situ et vetustate
SAEMUNDARSON NICOLAUS	<NIKULAS DI MUNKATHVERA>	Iter ad loca sancta
SAEWULF		Peregrinatio ad Hierosolymam (De situ Hierusalem sive Relatio de peregrinatione ad Hierosolymam et Terram Sanctam)
SANCII DE AREVALO, RODERICUS	<SANCHEZ DE ARÉVALO, RODRIGO>	Libellus de situ et descriptione Hispaniae
SANUTUS TORSELLUS [TORXELLUS], MARINUS	<SANUDO [TORSELLO], MARIN>	Conditiones Terrae Sanctae
SANUTUS TORSELLUS [TORXELLUS], MARINUS	<SANUDO [TORSELLO], MARIN>	Opus Terrae Sanctae
SANUTUS TORSELLUS [TORXELLUS], MARINUS	<SANUDO [TORSELLO], MARIN>	Liber secretorum fidelium Crucis
SAVONAROLA, MICHAEL	<SAVONAROLA, MICHELE>	De balneis et thermis naturalibus omnibus Italiae
SCILLACIUS, NICOLAUS	<SCILLACO, NICOLA>	De insulis Meridiani atque Indici maris nuper inventis
SCINTILLA, ENGELHARDUS	<FUNK [SCINTILLA], ENGELHARD>	Descriptio opidi patrii Suobacensis elegantissima (De laude patriae suae)
SIMEONIS, SIMON		Itinerarium in Terram Sanctam
SISGOREUS, GEORGIUS SIBENICENSIS	< SIZGORIC, JURAJ >	De situ Illyriae et civitate Sebenici
STELLA, ERASMUS	<STÜLER, ERASMUS>	De origine, vetustate, appellatione et regionibus Tubantinorum, Cygneorum, Libanothanorum, Misnensium, nec non Molbii fluminis descriptione
STROZZA [STROZZIUS], TITUS VESPASIANUS	<STROZZI, TITO VESPASIANO>	De situ ruris Pelosellae at victoria venatica Birrothi et de eius connubio
TEXTORIS, GUILLELMUS		Itinerarium Terrae Sanctae
THEODERICUS MONACHUS		Libellus de locis sanctis
THEODOSIUS ARCHIDIACONUS		De situ Terrae Sanctae
THIETMARUS MAGISTER DE MERSEBURG	< THIETMAR VON MERSEBURG>	Peregrinatio (Liber peregrinationis)
THOMAS FRIGIDI MONTIS	<TOMMASO DI MONTEFREDDO>	Liber de periculis et peregrinatione Margaritae sororis suae (Tractatus de locis et statu sancte terre Ierosolimitane) (Hodoeporicon et pericula Margaritae Iherosolimitanae) (Peregrinatio periculosa) (Vita et pericula Margaretae sororis suae)
TRAVERSARIUS, AMBROSIUS	<TRAVERSARI, AMBROGIO>	Hodoeporicon (Commentariola)
TREZENZONIUS	<TREZENZONIO>	De Solistitionis Insula Magna
TRIBBE, HENRICUS		Descriptio urbis et episcopatus Mindensis
TUDEBODUS, PETRUS	<TUDEBODE, PIETRO>	Historia de Hierosolymitano itinere
TÜRST TIGURINUS, CONRADUS		De situ Confoederatorum descriptio
VERGERIUS, PETRUS PAULUS [HISTRUS; IUSTINOPOLITANUS]	<VERGERIO, PIETRO PAOLO, IL VECCHIO>	De urbe Iustinopoli
WALTERUS DE ZIRIXSEE, GUILLELMUS		Descriptio de tota terra promissionis cum Hierusalem
WALTHERUS DE GUGLINGEN, PAULUS	<WALTER, PAULUS>	Itinerarium in Terram Sanctam et ad Sanctam Catharinam
WEY, GUILLELMUS		Itinerarium peregrinacionis ad sanctum Iacobum in Ispannya
WEY, GUILLELMUS		Itinerarium peregrinacionis ad sepulcrum sanctissimum
WEY, GUILLELMUS		Itinerarium secundum ad Terram Sanctam
WILBRANDUS OLDENBURGENSIS	<WILBRAND VAN OLDENBURG>	Itinerarium Terrae Sanctae
WOLFGANGUS DE STIRA		Itinerarium
WORCESTRIUS, GUILLELMUS	<WORCESTER, WILLIAM>	Itineraria